{
  "$schema": "https://json-schema.org/draft/2020-12/schema",
  "$id": "https://konyklabs.github.io/vendorfake/fidelity/declaration.schema.json",
  "title": "vendorfake fidelity declaration v1",
  "type": "object",
  "additionalProperties": false,
  "required": [
    "schema",
    "sources"
  ],
  "properties": {
    "schema": {
      "const": 1
    },
    "sources": {
      "type": "array",
      "minItems": 1,
      "items": {
        "type": "object",
        "additionalProperties": false,
        "required": [
          "kind",
          "url"
        ],
        "properties": {
          "kind": {
            "enum": [
              "openapi3",
              "swagger2",
              "fragments"
            ]
          },
          "url": {
            "type": "string",
            "format": "uri"
          },
          "base_path": {
            "type": "string"
          },
          "label": {
            "type": "string",
            "minLength": 1
          }
        }
      }
    },
    "error_envelope": {
      "type": "string",
      "pattern": "^[1-5][0-9][0-9]$"
    },
    "error_member": {
      "type": "string",
      "minLength": 1
    },
    "aliases": {
      "type": "array",
      "items": {
        "type": "object",
        "additionalProperties": false,
        "required": [
          "method",
          "path",
          "spec_path",
          "reason"
        ],
        "properties": {
          "method": {
            "type": "string"
          },
          "path": {
            "type": "string"
          },
          "spec_path": {
            "type": "string"
          },
          "reason": {
            "type": "string",
            "minLength": 1
          }
        }
      }
    },
    "excused": {
      "type": "array",
      "items": {
        "type": "object",
        "additionalProperties": false,
        "required": [
          "method",
          "path",
          "reason"
        ],
        "properties": {
          "method": {
            "type": "string"
          },
          "path": {
            "type": "string"
          },
          "reason": {
            "type": "string",
            "minLength": 1
          }
        }
      }
    },
    "deviations": {
      "type": "array",
      "items": {
        "type": "object",
        "additionalProperties": false,
        "required": [
          "pointer",
          "keyword",
          "reason",
          "url"
        ],
        "properties": {
          "pointer": {
            "type": "string",
            "pattern": "^/"
          },
          "keyword": {
            "type": "string",
            "minLength": 1
          },
          "value": {
            "type": [
              "string",
              "number",
              "boolean",
              "null"
            ],
            "description": "The one instance value excused, in its JSON type; null is a value."
          },
          "reason": {
            "type": "string",
            "minLength": 1
          },
          "url": {
            "type": "string",
            "format": "uri"
          },
          "routes": {
            "type": "array",
            "items": {
              "type": "string",
              "pattern": "^[A-Z]+ /"
            }
          },
          "pattern": {
            "type": "string",
            "minLength": 1,
            "description": "A regular expression every excused instance must fully match; exactly one of value and pattern."
          }
        },
        "oneOf": [
          {
            "required": [
              "value"
            ],
            "not": {
              "required": [
                "pattern"
              ]
            }
          },
          {
            "required": [
              "pattern"
            ],
            "not": {
              "required": [
                "value"
              ]
            }
          }
        ]
      }
    },
    "variables": {
      "type": "object",
      "additionalProperties": {
        "type": "string"
      }
    },
    "annotations": {
      "type": "array",
      "description": "Machine-readable facts a vendor writes into operation prose (a required scope, say). The cutter strips prose, so each row lifts its fact out first and records it under x-vendorfake.annotations[name] keyed by route, where the extract's sha256 covers it and a vendor test can compare it against the unit's own table.",
      "items": {
        "type": "object",
        "additionalProperties": false,
        "required": [
          "name",
          "select"
        ],
        "properties": {
          "name": {
            "type": "string",
            "pattern": "^[a-z][a-z0-9_]*$"
          },
          "select": {
            "type": "string",
            "minLength": 1,
            "description": "Regular expression searched (MULTILINE) in each modeled operation's description; group 1 is the text `item` reads."
          },
          "item": {
            "type": "string",
            "minLength": 1,
            "description": "Regular expression found repeatedly in select's group 1; group 1 of each match is one recorded value. Omitted means select's group 1 is the one value."
          },
          "reason": {
            "type": "string",
            "minLength": 1
          }
        }
      }
    },
    "webhooks": {
      "type": "array",
      "uniqueItems": true,
      "description": "The entries of the document's top-level webhooks section this unit delivers. The cut carries each named entry and the schemas it reaches, and the corpus runner checks every delivery body against the entry it maps to. With several rows, every row needs event_types, the globs that map a delivery's event type onto it.",
      "items": {
        "type": "object",
        "additionalProperties": false,
        "required": [
          "name",
          "reason"
        ],
        "properties": {
          "name": {
            "type": "string",
            "minLength": 1,
            "description": "The entry's key exactly as the document spells it."
          },
          "reason": {
            "type": "string",
            "minLength": 1
          },
          "event_types": {
            "type": "array",
            "minItems": 1,
            "uniqueItems": true,
            "items": {
              "type": "string",
              "minLength": 1
            }
          }
        }
      }
    },
    "stubs_accepted": {
      "type": "array",
      "items": {
        "type": "string",
        "minLength": 1
      },
      "description": "Schema names the extract may stub to {} because upstream dangles there. Every stub in the extract must be listed, or pin --check --offline fails."
    },
    "vendored": {
      "type": "boolean",
      "description": "False = fetch-never-commit: only pin.json ships; the extract is cut at run time into a local cache."
    },
    "error_schema": {
      "type": "string",
      "minLength": 1,
      "description": "Component schema an error body is validated against when the document declares the status without a schema."
    },
    "extension_map": {
      "type": "object",
      "additionalProperties": {
        "type": "string"
      },
      "propertyNames": {
        "pattern": "^x-"
      }
    },
    "overrides": {
      "type": "array",
      "items": {
        "type": "object",
        "additionalProperties": false,
        "required": [
          "route",
          "status",
          "schema",
          "reason",
          "url"
        ],
        "properties": {
          "route": {
            "type": "string",
            "pattern": "^[A-Z]+ /"
          },
          "status": {
            "type": "integer",
            "minimum": 100,
            "maximum": 599
          },
          "schema": {
            "type": "string",
            "minLength": 1
          },
          "reason": {
            "type": "string",
            "minLength": 1
          },
          "url": {
            "type": "string",
            "format": "uri"
          }
        }
      }
    }
  },
  "dependentRequired": {
    "error_envelope": [
      "error_member"
    ]
  }
}
