{
  "schema": 1,
  "vendored": false,
  "sources": [
    {
      "kind": "openapi3",
      "url": "https://api-docs.lsk.lightspeed.app/source.json",
      "label": "k-series"
    }
  ],
  "error_schema": "apePaymentBadRequestError",
  "aliases": [],
  "excused": [
    {
      "method": "GET",
      "path": "/oauth/authorize",
      "reason": "Lightspeed's interactive consent screen, documented in prose on the V1 authorization overview (https://api-portal.lsk.lightspeed.app/quick-start/authentication/v1-authentication/v1-authorization-overview, fetched 2026-10-29) and absent from source.json, whose securitySchemes names the V2 OpenID Connect authorizationUrl. This unit serves a stand-in at the documented path that approves automatically; its route summary says so."
    },
    {
      "method": "POST",
      "path": "/oauth/token",
      "reason": "The V1 token endpoint, documented in prose only (same page, fetched 2026-10-29): code exchange from query parameters, refresh from a form body, HTTP Basic client authentication, a five-member JSON response. source.json's securitySchemes tokenUrl is the V2 OpenID Connect one, so no operation describes this route."
    }
  ],
  "deviations": [
    {
      "pointer": "/status",
      "keyword": "type",
      "pattern": "503",
      "routes": ["GET /o/op/data/businesses", "GET /o/op/1/menu/list"],
      "reason": "The document declares one */* error envelope, on apeGetMenuByIdV2's 503 and on tax-preview-apiTaxBreakdown's 400, 403, 404 and 503, and it types status as a string enum such as '503'; this unit answers that one envelope for every 503, and on the two routes that declare no 503 the body falls back to error_schema, whose status is an integer. One keyword, one pointer, the two routes.",
      "url": "https://api-docs.lsk.lightspeed.app/source.json"
    },
    {
      "pointer": "/status",
      "keyword": "type",
      "value": 403,
      "routes": ["POST /tp/v1/business-locations/{businessLocationId}/tax-breakdown"],
      "reason": "The kernel refuses a token without orders-api at pipeline step 5, before any vendor code runs, and the shaper sees no route, so this 403 keeps the integer-status envelope every other route answers; the document types status as the string enum '403'. The handler's own 400 and 404, and the 503, answer the declared string-status envelope. One keyword per row, one pointer, this route.",
      "url": "https://api-docs.lsk.lightspeed.app/source.json"
    },
    {
      "pointer": "/status",
      "keyword": "enum",
      "value": 403,
      "routes": ["POST /tp/v1/business-locations/{businessLocationId}/tax-breakdown"],
      "reason": "The kernel refuses a token without orders-api at pipeline step 5, before any vendor code runs, and the shaper sees no route, so this 403 keeps the integer-status envelope every other route answers; the document types status as the string enum '403'. The handler's own 400 and 404, and the 503, answer the declared string-status envelope. One keyword per row, one pointer, this route.",
      "url": "https://api-docs.lsk.lightspeed.app/source.json"
    }
  ],
  "overrides": [],
  "stubs_accepted": [],
  "variables": {
    "client_id": "unit-lightspeed-k-client-id",
    "client_secret": "unit-lightspeed-k-client-secret",
    "basic_auth": "Basic dW5pdC1saWdodHNwZWVkLWstY2xpZW50LWlkOnVuaXQtbGlnaHRzcGVlZC1rLWNsaWVudC1zZWNyZXQ=",
    "basic_auth_v2": "Basic ZGV2cC12Mi11bml0LWNsaWVudDp1bml0LWxpZ2h0c3BlZWQtay1jbGllbnQtc2VjcmV0",
    "redirect_uri": "https://consumer.example/callback",
    "access_token": "unit-lightspeed-k-access-token-full",
    "refresh_token": "unit-lightspeed-k-refresh-token-full",
    "financial_only_access_token": "unit-lightspeed-k-access-token-financial",
    "business_id": "100000000001",
    "business_location_id": "100000000101",
    "menu_id": "100000000201",
    "sku_a": "UNITK-001",
    "sku_b": "UNITK-002",
    "endpoint_id": "UNIT-K-ENDPOINT",
    "webhook_url": "https://receiver.example.test/hooks",
    "basic_user": "unit-k-user",
    "basic_password": "unit-k-password",
    "unknown_sku": "UNITK-404",
    "third_party_reference": "unit-k-order-1"
  }
}
